{
  "$schema": "https://json-schema.org/draft/2020-12/schema",
  "$id": "https://zen-agent.dev/schema/pack/v1.json",
  "title": "zen-agent 站点包契约 C4（pack manifest，SSOT）",
  "description": "站点包清单（packs/<packId>/pack.json）的权威契约。【pack = 分发单元】布局同构于 legacy 快照子树（features/<id>/{feature.md,facts.md,tools.json} + skills/<fn>/SKILL.md + docs/ + eval/），额外挂 packId 命名空间与 site 围栏。【激活键】site.origin 精确匹配 + site.locations 路径前缀（缺省 [\"/\"]，同 origin 多 pack 最长前缀胜出；同 origin 前缀重复 → 载入期 fail-closed 拒载）。featureIdRules 降为 pack 内规则，仅在 pack 激活后参与匹配。【版本化不可变（U4）】pack 独立 semver、发布后不可变；registry 登记其 packId+version。pack.json JSON 可序列化，跨端口传递满足 U1。【generic 兜底】generic=true 声明本 pack 为无站点 pack 命中时的兜底（与 site 互斥）：不参与 origin/location 匹配与站点索引，激活与 origin 围栏由服务端网关按准入名单以活跃页 origin 运行时绑定；registry 至多登记一个 generic pack。",
  "type": "object",
  "additionalProperties": false,
  "required": ["packId", "version", "featureIdRules"],
  "properties": {
    "packId": {
      "$comment": "pack 命名空间标识，与 packs/<packId>/ 目录名一致；featureId/toolId 审计与端口定位以 {packId, featureId} 二元组限定。",
      "type": "string",
      "pattern": "^[a-z][a-z0-9-]*$"
    },
    "version": {
      "$comment": "pack 版本（semver，可全序比较）；registry 登记同值，装配与审计事件回写该版本。",
      "type": "string",
      "pattern": "^[0-9]+\\.[0-9]+\\.[0-9]+(-[0-9A-Za-z][0-9A-Za-z.-]*)?$"
    },
    "summary": {
      "$comment": "一句话站点用途（渐进披露第一层，批次④后续）：进入'已安装站点索引'供 agent 跨站发现；缺省=索引回退用 packId。",
      "type": "string",
      "minLength": 1
    },
    "name": {
      "$comment": "pack 人读名（packs 页 / 注入透明视图 / 确认卡展示，如「闲鱼卖家」）；缺省=展示回退 packId。装配端经 describeInjection.packName 透出；配置中心 UI 消费落点=G4。",
      "type": "string",
      "minLength": 1
    },
    "site": {
      "$comment": "激活围栏：origin 精确匹配（scheme://host[:port]，无路径无尾斜杠）+ locations 路径前缀。",
      "type": "object",
      "additionalProperties": false,
      "required": ["origin"],
      "properties": {
        "origin": {
          "type": "string",
          "pattern": "^https?://[^/]+$"
        },
        "locations": {
          "$comment": "路径前缀数组（各以 / 起）；省略时装配器按缺省 [\"/\"]（整站）处理。",
          "type": "array",
          "minItems": 1,
          "items": { "type": "string", "pattern": "^/" }
        },
        "exclude": {
          "$comment": "否定路径前缀（Tampermonkey @exclude 范式）：命中任一前缀即不匹配本 pack，优先于 locations 判定（resolvePack 排除判定）。",
          "type": "array",
          "minItems": 1,
          "items": { "type": "string", "pattern": "^/" }
        }
      }
    },
    "tenant": {
      "$comment": "claims.tenant → origin 路由用（任务组，批次④）；MVP 单租户 demo 可省。",
      "type": "string",
      "pattern": "^[a-z][a-z0-9-]*$"
    },
    "generic": {
      "$comment": "generic 兜底 pack 标记（const true）：无任何站点 pack 命中时兜底激活；与 site 互斥（allOf 条件强制）。激活围栏不来自本清单——由网关运行时以活跃页 origin 绑定（服务端准入名单 fail-closed）。",
      "type": "boolean",
      "const": true
    },
    "featureIdRules": {
      "$comment": "pack 内 url → featureId 映射规则表（有序，首个命中生效）；仅在本 pack 激活后参与匹配。",
      "type": "array",
      "minItems": 1,
      "items": { "$ref": "#/$defs/featureIdRule" }
    },
    "features": {
      "$comment": "可选·pack 内功能闭单（featureId 列表）；声明时装配器启动校验各 features/<id>/ 目录齐备，缺失 fail-closed 拒载。",
      "type": "array",
      "uniqueItems": true,
      "items": { "$ref": "#/$defs/featureId" }
    },
    "engines": {
      "$comment": "平台兼容声明（VS Code engines 范式）：contract 为对平台契约版本（contracts 导出 contractVersion）的 semver range；载入期以 checkContractCompatibility 比对，range 非法或不满足即拒载（fail-closed，不降级猜测）。pattern 只做语法面守卫（token 闭集 + 至少一个版本数字），range 语法权威在载入期 semver 判定。",
      "type": "object",
      "additionalProperties": false,
      "required": ["contract"],
      "properties": {
        "contract": {
          "type": "string",
          "minLength": 1,
          "pattern": "^(?=.*[0-9xX*])[0-9A-Za-z.+*xX<>=^~\\s|-]+$"
        }
      }
    },
    "capabilities": {
      "$comment": "结构化能力声明（MCP capabilities 范式）：全部可选，知识型 pack（仅 feature.md+facts.md）合法缺省。",
      "type": "object",
      "additionalProperties": false,
      "properties": {
        "anchors": {
          "$comment": "引导锚点清单 featureId → 锚点数组，为锚点唯一登记处（facts.md 不承载锚点登记）；失配降级（R6），不作准入门槛。装配端消费锚点=D2（引导 capability 落地步）。",
          "type": "object",
          "minProperties": 1,
          "propertyNames": { "pattern": "^[a-z][a-z0-9-]*$" },
          "additionalProperties": {
            "type": "array",
            "minItems": 1,
            "items": { "$ref": "#/$defs/anchor" }
          }
        },
        "skills": {
          "$comment": "skills/<fn>/ 闭单：载入期与 skills/ 目录双向对账（声明有目录无 / 目录有声明无均拒载）。",
          "type": "array",
          "minItems": 1,
          "uniqueItems": true,
          "items": { "type": "string", "pattern": "^[a-z][a-z0-9-]*$" }
        },
        "docs": {
          "$comment": "docs/ 内文档相对路径闭单（禁前导 . 与路径穿越）：载入期与目录扫描对账。",
          "type": "array",
          "minItems": 1,
          "uniqueItems": true,
          "items": { "type": "string", "pattern": "^[A-Za-z0-9][A-Za-z0-9._/-]*\\.md$" }
        },
        "quickActions": {
          "$comment": "快捷提问库（R-5，纯数据 R2）：pack 作者预置的站点专属问法清单，面板 chips 与右键菜单同源消费。只承载「用户轮消息模板」——MUST NOT 进 system 注入、MUST NOT 改工具面与 riskTier，装配引擎不把它读进任何注入产物（U8 装配治理对对话免疫）。展开在服务端网关：C3 user-message 带 quickActionId，网关按 id 查表取 template 作本轮用户轮消息（客户端不持第二份模板副本）。占位符闭集 {{selection}}/{{url}}/{{title}}，闭集外的 {{…}} 一律拒——刻意不设整页正文占位，那会绕过 page-text 上限与证据规整。maxItems 20 = 一排 chips 的可读上界。",
          "type": "array",
          "minItems": 1,
          "maxItems": 20,
          "items": { "$ref": "#/$defs/quickAction" }
        },
        "builtinTools": {
          "$comment": "pack 声明其使用的平台内建工具族 ⊆ 平台已实现闭集（contracts 导出 packBuiltinTools），载入期交叉校验（fail-closed，越界拒载并报出越界值与 packId）；未声明 = 网关不注入任何平台内建工具面（缺省即不注入）。pattern 只做语法面守卫，值域权威在平台实现闭集。",
          "type": "array",
          "minItems": 1,
          "uniqueItems": true,
          "items": { "type": "string", "pattern": "^[a-z][a-z0-9-]{0,63}$" }
        }
      }
    },
    "configSchema": {
      "$comment": "pack 声明的用户可配置点（adr-020）：JSON Schema 对象（含默认值，纯数据）——可变空间由 pack 作者定义，用户只在空间内取值；L2 packConfig 写入期按此校验（schema 不存在或值越界即拒），参数值以结构化数据注入、不改变工具 riskTier 与治理面。载入期校验其为可编译 JSON Schema。形态收紧为扁平顶层声明：可配置键闭集 = 顶层 properties 的键，additionalProperties 必须钉死 false，顶层不得出现 $ref/allOf/patternProperties 等组合关键字——注入期按同一份顶层 properties 取键，两端由此同源，写入端接受而注入端静默丢弃的形态在载入期即被拒。键的值 schema 可任意复杂，需要复用时用 $defs + 值内 $ref。",
      "type": "object",
      "required": ["type", "properties", "additionalProperties"],
      "properties": {
        "$schema": { "type": "string" },
        "title": { "type": "string" },
        "description": { "type": "string" },
        "type": { "const": "object" },
        "properties": { "type": "object", "minProperties": 1 },
        "required": { "type": "array", "items": { "type": "string" } },
        "additionalProperties": { "const": false },
        "$defs": { "type": "object" }
      },
      "additionalProperties": false
    },
    "integrity": {
      "$comment": "canonical 文件清单 sha256（U4 不可变的机械化验证）：键=pack 内相对路径，值=sha256 hex。装配端校验启用锚点=P3.5（打包分发时）。",
      "type": "object",
      "minProperties": 1,
      "propertyNames": { "pattern": "^[A-Za-z0-9][A-Za-z0-9._/-]*$" },
      "additionalProperties": { "type": "string", "pattern": "^[a-f0-9]{64}$" }
    }
  },
  "allOf": [
    {
      "$comment": "generic 与 site 互斥：声明 generic 则 MUST 省略 site；未声明则 site 必填（站点 pack 契约不变）。子模式内重复声明 properties 仅为满足 Ajv strictRequired，约束本体在根 properties。",
      "if": { "properties": { "generic": { "const": true } }, "required": ["generic"] },
      "then": { "properties": { "site": false } },
      "else": { "properties": { "site": true }, "required": ["site"] }
    }
  ],
  "$defs": {
    "anchor": {
      "$comment": "引导锚点：id 供规则/skill 引用；role/label 与快照元素词汇对齐；selectorHint 为 CSS 选择器提示（可选），失配时客户端静默降级为文字说明（R6）。",
      "type": "object",
      "additionalProperties": false,
      "required": ["id", "role", "label"],
      "properties": {
        "id": { "type": "string", "pattern": "^[a-z][a-z0-9-]{0,63}$" },
        "role": { "type": "string", "minLength": 1 },
        "label": { "type": "string", "minLength": 1 },
        "selectorHint": { "type": "string", "minLength": 1, "maxLength": 200 }
      }
    },
    "quickAction": {
      "$comment": "快捷提问条目（L1/L2 同形）：id 为查表键、label 为 chip 与右键菜单文案、template 为展开后的用户轮消息、context 声明它需要什么页面材料（selection=选区正文 / page=当前页地址与标题 / none=纯问法）。featureIds 缺省 = 整 pack 可见；声明时客户端只在命中的 featureId 上呈现。context=selection 的模板 MUST 含 {{selection}}——否则右键取到的选区正文无处落，菜单项点了等于没带材料。",
      "type": "object",
      "additionalProperties": false,
      "required": ["id", "label", "template", "context"],
      "properties": {
        "id": { "type": "string", "pattern": "^[a-z][a-z0-9-]{0,63}$" },
        "label": { "type": "string", "minLength": 1, "maxLength": 40 },
        "template": {
          "type": "string",
          "minLength": 1,
          "maxLength": 2000,
          "not": { "pattern": "\\{\\{(?!(?:selection|url|title)\\}\\})" }
        },
        "context": { "type": "string", "enum": ["selection", "page", "none"] },
        "featureIds": {
          "type": "array",
          "minItems": 1,
          "uniqueItems": true,
          "items": { "$ref": "#/$defs/featureId" }
        }
      },
      "allOf": [
        {
          "$comment": "子模式内重复声明 template 仅为满足 Ajv strict；约束本体在上方 properties。",
          "if": { "properties": { "context": { "const": "selection" } }, "required": ["context"] },
          "then": { "properties": { "template": { "type": "string", "pattern": "\\{\\{selection\\}\\}" } } }
        }
      ]
    },
    "featureId": {
      "$comment": "功能标识文法，与 config-snapshot / tool-definition 及 features/<id>/ 目录名一致（跨契约对齐）。",
      "type": "string",
      "pattern": "^[a-z][a-z0-9-]*$"
    },
    "featureIdRule": {
      "type": "object",
      "additionalProperties": false,
      "required": ["urlPattern", "featureId"],
      "properties": {
        "urlPattern": {
          "$comment": "ECMAScript 正则源串，对页面完整 URL 做 test 匹配（不含斜杠定界符与 flags）。",
          "type": "string",
          "minLength": 1
        },
        "featureId": { "$ref": "#/$defs/featureId" }
      }
    }
  }
}
